{"$schema":"https://json-schema.org/draft/2020-12/schema","$defs":{"id":{"type":"string","pattern":"^[a-z0-9][a-z0-9-]*$","minLength":3},"sourceIds":{"type":"array","items":{"type":"string","minLength":3},"minItems":1,"uniqueItems":true},"contentStatus":{"enum":["planned","draft","machine-assisted","human-reviewed","production-ready","fixture"]},"translationReviewStatus":{"enum":["draft","machine-assisted","human-reviewed"]},"ref":{"type":"object","required":["id","path"],"properties":{"id":{"$ref":"#/$defs/id"},"path":{"type":"string","minLength":3}},"additionalProperties":false},"reviewMetadata":{"type":"object","required":["reviewStage","reviewReason"],"properties":{"firstIntroducedIn":{"type":["string","null"]},"reviewStage":{"type":"integer","minimum":1},"reviewReason":{"type":"string","minLength":3},"previousExerciseId":{"type":["string","null"]}},"additionalProperties":false}},"title":"HSK assessment","type":"object","required":["recordType","id","syllabusVersion","examBlueprintVersion","level","assessmentType","titleZh","titleVi","exerciseRefs","sections","skillWeights","targetGrammar","targetVocabulary","difficultyDistribution","rubric","sourceIds","contentStatus","reviewStatus","contentVersion"],"properties":{"recordType":{"const":"assessment"},"id":{"$ref":"#/$defs/id"},"syllabusVersion":{"type":"string"},"examBlueprintVersion":{"type":"string"},"level":{"type":"integer","minimum":1,"maximum":9},"assessmentType":{"enum":["mini-checkpoint","midpoint","end-checkpoint","practice-test","mastery-review","final"]},"titleZh":{"type":"string","minLength":1},"titleVi":{"type":"string","minLength":1},"exerciseRefs":{"type":"array","items":{"$ref":"#/$defs/id"},"minItems":1,"uniqueItems":true},"sections":{"type":"object","minProperties":1},"skillWeights":{"type":"object","minProperties":1},"targetGrammar":{"type":"array","items":{"$ref":"#/$defs/id"}},"targetVocabulary":{"type":"array","items":{"$ref":"#/$defs/id"}},"difficultyDistribution":{"type":"object","minProperties":1},"rubric":{"type":"object","minProperties":1},"sourceIds":{"$ref":"#/$defs/sourceIds"},"contentStatus":{"$ref":"#/$defs/contentStatus"},"reviewStatus":{"enum":["unreviewed","blueprint-reviewed","approved"]},"contentVersion":{"type":"integer","minimum":1}},"additionalProperties":false}