{"recordType":"assessment","id":"hsk1-fixture-u01-checkpoint","syllabusVersion":"GF0025-2021","examBlueprintVersion":"CTI-HSK3.0-2026","level":1,"assessmentType":"mini-checkpoint","titleZh":"第一单元小测","titleVi":"Mini-checkpoint Unit 1","exerciseRefs":["hsk1-fixture-ex-listening-01","hsk1-fixture-ex-reading-01","hsk1-fixture-ex-writing-01","hsk1-fixture-ex-speaking-01"],"sections":{"listening":{"count":1},"reading":{"count":1},"writing":{"count":1},"speaking":{"count":1}},"skillWeights":{"listening":0.25,"reading":0.25,"writing":0.25,"speaking":0.25},"targetGrammar":["hsk1-fixture-g-a-shi-b","hsk1-fixture-g-jiao-name"],"targetVocabulary":["hsk1-fixture-v-nihao","hsk1-fixture-v-wo","hsk1-fixture-v-jiao","hsk1-fixture-v-xuesheng"],"difficultyDistribution":{"1":4},"rubric":{"passThreshold":0.75,"speaking":"Communicates the intended greeting and identity with intelligible pronunciation."},"sourceIds":["moe-gf0025-2021-standard","cti-hsk3-current-syllabus-2026"],"contentStatus":"fixture","reviewStatus":"unreviewed","contentVersion":1}